ID,patent_title,patent_year,patent_abstract,label
905,Microfluidic devices and methods of fabrication,2014,"The present invention relates to microfluidic devices that comprise a 3-D microfluidic network of microchannels of arbitrary complexity and to a method for fabricating such devices. In particular, the invention relates to a method of forming microfluidic devices having 3-D microfluidic networks that contain open or closed loop microchannels using a single-step molding process without the need for layer-by-layer fabrication, and to the resultant microfluidic devices. The networks of such microfluidic devices may comprise one or more microchannel circuits which may be discrete or interconnected.",False
906,Method and system for reversal of interactions between hydrophobically modified biopolymers and vesicles or cell membranes,2014,"A method for reversing gelation of hydrophobically modified biopolymer attached to vesicle or cell membranes. The gelation of hydrophobically modified biopolymer attached to vesicles or cell membranes is reversed by application of a supramolecule, such as cyclodextrin, to the gelled composition. The supramolecule disrupts the interactions between the hydrophobically modified biopolymer and the vesicle or cell membrane, without affecting the structure of the membrane or the hydrophobically modified polymer to which the hydrophobic substituents are attached. A kit for treating wounds that includes a hydrophobically modified biopolymer and a supramolecule. The hydrophobically modified biopolymer is used to stop bleeding and the supramolecule is used to remove the hydrophobically modified biopolymer.",True
907,Sintered wire cesium dispenser photocathode,2014,"A photoelectric cathode has a work function lowering material such as cesium placed into an enclosure which couples a thermal energy from a heater to the work function lowering material. The enclosure directs the work function lowering material in vapor form through a low diffusion layer, through a free space layer, and through a uniform porosity layer, one side of which also forms a photoelectric cathode surface. The low diffusion layer may be formed from sintered powdered metal, such as tungsten, and the uniform porosity layer may be formed from wires which are sintered together to form pores between the wires which are continuous from the a back surface to a front surface which is also the photoelectric surface.",False
908,Systems and methods for multiple pitch tracking using a multidimensional function and strength values,2014,"An apparatus includes a function module, a strength module, and a filter module. The function module compares an input signal, which has a component, to a first delayed version of the input signal and a second delayed version of the input signal to produce a multi-dimensional model. The strength module calculates a strength of each extremum from a plurality of extrema of the multi-dimensional model based on a value of at least one opposite extremum of the multi-dimensional model. The strength module then identifies a first extremum from the plurality of extrema, which is associated with a pitch of the component of the input signal, that has the strength greater than the strength of the remaining extrema. The filter module extracts the pitch of the component from the input signal based on the strength of the first extremum.",False
909,Advanced functional biocompatible foam used as a hemostatic agent for compressible and non-compressible acute wounds,2014,"A sprayable polymeric foam hemostat for both compressible and non-compressible (intracavitary) acute wounds is disclosed. The foam comprises hydrophobically-modified polymers, such as hm-chitosan, or other amphiphilic polymers that anchor themselves within the membrane of cells in the vicinity of the wound. By rapidly expanding upon being released from a canister pressurized with liquefied gas propellant, the foam is able to enter injured body cavities and staunch bleeding. The seal created is strong enough to substantially prevent the loss of blood from these cavities. Hydrophobically-modified polymers inherently prevent microbial infections and are suitable for oxygen transfer required during normal wound metabolism. The amphiphilic polymers form solid gel networks with blood cells to create a physical clotting mechanism that prevent loss of blood.",True
910,Method of performance-aware security of unicast communication in hybrid satellite networks,2014,"A method and apparatus utilizes Layered IPSEC (LES) protocol as an alternative to IPSEC for network-layer security including a modification to the Internet Key Exchange protocol. For application-level security of web browsing with acceptable end-to-end delay, the Dual-mode SSL protocol (DSSL) is used instead of SSL. The LES and DSSL protocols achieve desired end-to-end communication security while allowing the TCP and HTTP proxy servers to function correctly.",False
911,"Cross-linked polymer matrices, and methods of making and using same",2014,"Functionalized chondroitin sulfate, cross-linked polymer matrices comprising functionalized chondroitin sulfate, and methods of making and using the same are provided. Such polymer matrices may be used for tissue engineering, reconstructing cartilage, and the like. Kits are also provided for detection of cartilage degrading enzymes.",True
912,Remote nanoscale photochemistry using guided emission in nanowires,2014,"A method of fabricating a nanodevice includes providing a nanowire having a first portion and a second portion. The nanowire has a polymer coating. A nanostructure is provided that is proximate to the second portion of the nanowire. Solely the first portion of the nanowire is irradiated with near-infrared radiation, thereby exciting the first portion to generate ultraviolet radiation. The generated ultraviolet radiation is guided from the first portion along the nanowire toward the second portion, so that a region of the polymer coating on the second portion is polymerized and bonds the nanostructure to the nanowire.",False
913,Microwave accelerated assays,2014,The present invention provides for increasing fluorescence detection in surface assay systems while increasing kinetics of a bioreaction therein by providing low-power microwaves to irradiate metallic materials within the system in an amount sufficient to increase heat thereby affecting the kinetics of a bioreaction therein.,False
914,Esophageal cancer markers,2014,The present invention is directed to methods for diagnosing cancer in a subject. Morphologically normal epithelial cells of the esophagus are assayed for marker expression. Characteristic expression of the markers indicates the presence of cancer or the predisposition to cancer. A panel of eleven markers are particularly good at identifying cancer and the predisposition to cancer.,True
915,"Voltage-gated metal-enhanced fluorescence, chemiluminescence or bioluminescence methods and systems",2014,"In the present invention, it is demonstrated for the first time, the influence of electrical current on the ability of surface plasmons to amplify fluorescence signatures. An applied direct current across silver island films (SiFs) of low electrical resistance perturbs the fluorescence enhancement of close-proximity fluorophores. For a given applied current, surface plasmons in “just-continuous” low resistance films are sparsely available for fluorophore dipole coupling and hence the enhanced fluorescence is gated as a function of the applied current.",False
916,Antiproliferative factor and methods of use,2014,"A novel antiproliferative factor comprising a glycopeptide is disclosed. In specific embodiments, the novel antiproliferative factor is associated with the bladder. Compositions, diagnostic kits and reagents, and methods of using the compounds for identifying and/or treating interstitial cystitis and cancer are disclosed.",True
917,Immunoglobulin constant region FC receptor binding agents,2014,"IVIG replacement compounds are derived from recombinant and/or biochemical creation of immunologically active biomimetic(s). These replacement compounds are then screened in vitro to assess each replacements compound's efficiency at modulating immune function. Particular replacement compounds are selected for further in vivo validation and dosage/administration optimization. Finally, the replacement compounds are used to treat a wide range of diseases, including inflammatory and autoimmune diseases.",True
918,Heterologous expression of extremophile heat shock proteins and chaperones in microorganisms to increase tolerance to toxic compounds,2014,"The invention provides methods and compositions for increasing tolerance of microorganisms to toxic agents, such as solvents; and for increasing production of solvents from solvent-generating microorganisms. The methods comprise engineering a microorganism of interest to express a heterologous heat-shock protein/chaperone, e.g., Group II chaperonin or a prefoldin such as γ-prefoldin, where the heterologous protein is from an extremophile, such as an archaean.",True
919,Methods for the production of nanoscale heterostructures,2014,"The present invention is directed to a novel synthetic method for producing nanoscale heterostructures, and particularly nanoscale heterostructure particles, rods and sheets, that comprise a metal core and a monocrystalline semiconductor shell with substantial lattice mismatches between them. More specifically, the invention concerns the use of controlled soft acid-base coordination reactions between molecular complexes and colloidal nanostructures to drive the nanoscale monocrystalline growth of the semiconductor shell with a lattice structure incommensurate with that of the core. The invention also relates to more complex hybrid core-shell structures that exhibit azimuthal and radial nano-tailoring of structures. The invention is additionally directed to the use of such compositions in semiconductor devices.",False
920,Fuel efficient ultra-low emission and improved pattern factor colorless distributed combustion for stationary and propulsion gas turbine applications,2014,"Colorless distributed combustion (CDC) reactors or green combustion gas turbine combustors having a combustion chamber are presented for improved performance of gas turbine combustion engines. The combustors are configured and designed for providing a superior pattern factor (uniform thermal field in the combustion zone) and a reduction or complete elimination of pollutants emission from the combustor (i.e., zero emission gas turbine combustor) and uniform thermal field in the entire combustion zone to provide significantly improved pattern factor. Colorless distributed combustion is achieved with fuel and air entering the combustion chamber via one or more injection ports as non-premixed, or premixed. Rectangular, cylindrical, stadium and elliptical shaped combustors are presented with injection ports and exit ports located in various locations of the combustors. The mixture preparation between fuel and air with the hot combustion products is carried out either with the gases present in the combustion chamber or via a communication link between the exit gases from the combustor back to the combustion chamber.",False
921,In vivo biofilm infection diagnosis and treatment,2014,"The present invention relates to a method for in vivo detection of a biofilm infection residing in a mammal, the method comprising (i) administering to the mammal a diagnostic-effective amount of a biofilm-specific probe, wherein the probe comprises a bio film-targeting moiety and a paramagnetic nanoparticle core; and (ii) imaging the mammal to detect the presence of the biofilm infection by observing the mammal using a magnetic resonance diagnostic technique after the biofilm-specific probe has been provided sufficient time to selectively bind to the bio film infection that may be present in the mammal. The invention also relates to methods of treatment of a bio film infection, and compositions and kits useful in the detection and/or treatment of bio film infections.",True
922,Method of treating organophosphorous poisoning,2014,A method for treating organophosphorous poisoning (OP) comprising administering to a mammal at risk for OP poisoning an OP poisoning-inhibiting amount of galantamine.,True
923,Small molecule inhibitors of kynurenine-3-monooxygenase,2014,The present invention relates to compounds of formula Ia or Ib below and their tautomers and/or pharmaceutically acceptable salts and compositions and methods of uses thereof.,True
924,Cyclic acetal biomaterials,2014,"A novel class of Cylic Acetal biomaterials (CABs) based on a cyclic acetal unit is disclosed and claimed by Applicants. Two novel biomaterials suitable for use in a variety of biological applications including in the orthopedic field for joint and cartilage replacement and/or repair, and bone cement. The biomaterials are comprised of either a network of monomers of 5-ethyl-5-(hydroxymethyl)-β,β-dimethyl-1,3-dioxane-2-ethanol diacrylate (EHD) and a hydrogel comprised of EHD and poly(ethylene glycol) diacrylate (PEG-EHD).",True
925,Drug authentication,2014,"A method is disclosed to verify and identify pharmaceutical products through their product signatures in order to combat counterfeiting and reduce dispensing errors, using methods such as near infrared spectroscopy. Furthermore, in order actively evade pharmaceutical product counterfeiting, a method is disclosed where an amount of one or more of the inactive ingredients is varied over time; the variation provides a different product signature, but falling within a level deemed permissible by a regulatory body.",True
926,Metal enhanced fluorescence from metallic nanoburger structures,2014,"The present invention provides for metallic nanostructures or nanoburgers comprising a dielectric layer positioned between metallic layers and their use in metal enhanced emissions systems to enhance emissions from fluorophores, including intrinsic and extrinsic; luminophores; bioluminescent species and/or chemiluminescent species. The multilayer nanoburgers exhibit several distinctive properties including significantly enhanced intensity of emissions, decreased lifetime and increased photostability by simply varying the thickness of the dielectric layer while maintaining a constant thickness of the two metallic layers on opposite sides of the dielectric layer.",False
927,Compositions and methods utilizing fibrin beta chain fragments,2014,"A composition including a peptide sequence of the formula βX1-X2, the peptide sequence corresponding to an amino acid sequence of a fibrin beta chain fragment of a Bbeta chain of fibrinogen, wherein X1 represents an N-terminal end of the peptide sequence, and X2 represents a C-terminal end of the peptide sequence, wherein the peptide sequence includes additional amino acids between X1 and X2, wherein the peptide sequence may contain a non-naturally occurring amino acid residue, wherein the peptide sequence is other than a wild-type β15-42 monomer sequence per se, and wherein the peptide sequence is other than (β15-66)2 dimer having two chains with each chain limited to wild type amino acids β15-65 and each chain further including a non-naturally occurring Gly at position 66 of each chain. Methods for treatment and pharmaceutical combinations may include a polypeptide agent such as Thymosin beta 4. In such methods and combinations, a dimer of the peptide sequence may include amino acids 15-66 of the fibrin beta chain.",True
928,Microcin H47 plasmid selection system,2014,"The present invention relates generally to stabilized expression plasmid systems. The stabilized expression plasmid systems comprise an expression vector that includes a plasmid maintenance system (PMS) and, optionally, one or both of a polynucleotide encoding a selected antigen under control of a promoter, and a polynucleotide encoding a selectable marker under control of a promoter. The use of the mchI protein as a selectable marker is found in preferred embodiments of the invention.",True
929,Path oracles for spatial networks,2014,One embodiment of the invention is directed to a method including constructing a path-distance oracle that provides both an intermediate vertex of a shortest path between two vertices in a spatial network and an approximate distance between the two vertices. The constructing comprises decomposing the spatial network into a set of path-coherent pairs (PCPs) that satisfy at least one predefined property.,False
930,Techniques for compensating movement of a treatment target in a patient,2014,"One embodiment includes a method of predicting a position of a target site inside a body using surrogates is provided. The method includes transforming surrogate measurements and target positions into different representations by applying an operator, establishing a special relationship between the transformed surrogate measurements and the transformed target positions, and continuously predicting the target position from the transformed surrogate measurements and the established special relationship.",False
931,Metal enhanced fluorescence-based sensing methods,2014,The present invention relates to metallic-surface detection systems for determining target substances including free bilirubin in neonatal serum in the presence of a predominantly high background of bilirubin bound Human Serum Albumin (HSA) or sensing and isolating target nucleotide sequences wherein a fluorescence signal is enhanced by close proximity of the target substances near metallic surfaces.,False
932,Plasminogen activator inhibitor-1 inhibitors and methods of use thereof to modulate lipid metabolism,2014,"The invention relates to plasminogen activator-1 (PAI-1) inhibitor compounds and uses thereof in the treatment of any disease or condition associated with elevated PAI-1. The invention includes, but is not limited to, the use of such compounds to modulate lipid metabolism and treat conditions associated with elevated PAI-1, cholesterol, or lipid levels.",True
933,Methods and compositions for modulation of blood-neural barrier,2014,"Methods and compositions for modulating blood-neural barrier (BNB) for the treatment of CNS conditions such as edema, and for increased drug delivery efficacy across the BNB. The present invention further relates to improved tPA treatment of ischemic cerebrovascular and related diseases in combination with antagonism of the PDGF signaling pathway. The inventive method and composition is particularly suitable for conjunctive therapy of ischemic stroke using tPA and an anti-PDGF-C antagonist or an anti-PDGFR-α antagonist.",True
934,Targeted carriers for drug delivery across the gastrointestinal epithelium,2014,"A system and method for transcellular transport of compositions containing agents (e.g., research, analytical, reporter or molecular probes, diagnostic and therapeutic agents, biologically active agents, research agents, analytical agents, imaging agents, monitoring agents, enzymes, proteins, peptides, nucleic acids, lipids, sugars, hormones, lipoproteins, chemicals, viruses, bacteria, cells, including modified cells, biosensors, markers, antibodies and/or ligands) across the gastrointestinal epithelial layer including use of a composition containing the agent and a targeting moiety, specific for a determinant at the target location. An exemplary composition of the system includes an anti-ICAM antibody targeting moiety, specific for targeting ICAM-1. The system enables effective, versatile, and safe targeting and transport of agents. The system is useful in research applications, as well as in the context of translational science and clinical interventions.",True
935,Compositions and methods of inducing endoplasmic reticulum stress response for the treatment of cell proliferative diseases,2014,"The present invention provides methods of inducing cell cycle arrest and/or cell growth inhibition, with the methods comprising administering to the cells an effective dose of the compounds of the present invention.",True
936,Targeting NAD biosynthesis in bacterial pathogens,2014,"The emergence of multidrug-resistant pathogens necessitates the search for new antibiotics acting on previously unexplored targets. Nicotinate mononucleotide adenylyltransferase of the NadD family, an essential enzyme of NAD biosynthesis in most bacteria, was selected as a target for structure-based inhibitor development. To this end, the inventors have identified small molecule compounds that inhibit bacterial target enzymes by interacting with a novel inhibitory binding site on the enzyme while having no effect on functionally equivalent human enzymes.",True
937,Method and equipment for image-guided stereotactic radiosurgery of breast cancer,2014,"A method of treating a cancerous region in a breast of a patient comprising (i) imaging the breast in a three-dimensional coordinate system, (ii) stereotactically determining the location of the cancerous region in the breast, (iii) optionally determining the volume of the entire cancerous region to be treated, and (iv) while maintaining the breast in a three-dimensional coordinate system that is identical to or corresponds with the three-dimensional coordinate system used in (i), noninvasively exposing the cancerous region of the breast of the patient to a cancer-treatment effective dose of radiation; and equipment for use in such a method.",True
938,"Fibrous assemblies for antibody presentation, and multiplexed antigenic analysis using same",2014,"Biofunctionalized fibers including a fiber platform and a histidine-tagged protein and, optionally, an antibody. Chitosan is a fiber useful as the fiber platform. The fiber platform may be treated with nickel or may be directly linked to the histidine-tagged protein e.g., histidine-tagged streptococcal IgG-binding protein, protein G, protein G3T, GFP or RFP. The resulting biofunctionalized fibers can be assembled into protein fiber assemblies by a variety of biofabrication methods. The fiber assemblies, e.g., in the form of woven fabrics, are useful for (i) antigen capture; (ii) immunoanalysis, and/or (iii) multiplexed analysis. In one fabrication, each fiber of a fiber assembly presents a specific antibody, and mixing and matching of fibers, for example by weaving of fabrics from various antibody-presenting fibers, allows for multiple antigens to be captured simultaneously for multiplexed analysis.",True
939,Enzymic production of neoagarobiose,2014,"The present invention is directed to methods and systems of producing neoagarobiose, useful in whitening melanoma cells and in cosmetics, using polypeptides having neoagarobiosebiohydralase activity, including Aga86E from Saccharophagus degradans. The reaction can be enhanced by including other agarases, including Aga16B, also from S. degradans.",True
940,Defensin-like molecules as novel antimicrobial agents,2014,"Disclosed are methods of treating and/or preventing infections in mammals caused by microorganisms, by administering to a mammal a therapeutically effective amount of at least one defensin-like molecule, e.g., in a composition that includes such molecule. Also disclosed are the use of such defensin-like molecules for treating and/or preventing infections in mammals; and kits that may include such molecules, or compositions that include such molecules, as well as instructions for using such molecules to treat a mammal.",True
941,Carbon nanotube compositions and methods of making and using same,2014,"Carbon nanotube compositions suitable for printing, methods of making carbon nanotube compositions, and substrates having a print thereon containing carbon nanotube compositions, and uses thereof. The carbon nanotubes of the compositions are individualized. The carbon nanotube compositions can be used in applications, such as document security.",True
942,Conversion of just-continuous metallic films to large particulate substrates for metal-enhanced fluorescence,2014,"The present invention relates to a method of producing silver films having large nanoparticles caused by cracking during anaerobic annealing to provide surfaces that exhibit increased metal enhanced fluorescence. Preferably the annealing process is conducted on a silver film having a thickness from about 14 to 17 nm for about an hour at a temperature of approximately 190° C. to about 210° C. resulting in the conversion of the just-continuous films into large particulate films, not readily assessable by other chemical deposition techniques.",False
943,Heterocyclic benzoxazole compositions as inhibitors of hepatitis C virus,2014,"This invention relates to benzoxazole compounds, compositions and devices for delivering them, processes for manufacturing them, and methods of using them in the treatment of Hepatitis C Virus.",True
944,Methods of treating a diabetic embryopathy,2014,"Maternal diabetes can lead to a developmental malformation of an embryo. A developmental malformation caused by maternal diabetes is commonly referred to as a diabetic embryopathy. There is currently no effective treatment for reducing or inhibiting a diabetic embryopathy. To this end, the present invention is drawn to novel methods of treating a diabetic embryopathy.",True
