ID,patent_title,patent_year,patent_abstract,label
625,Proteins in enteroaggregative Escherichia coli (EAEC) useful for diagnosis and therapy of EAEC infections,2009,"Novel proteins and their corresponding nucleotide sequences in enteroaggregative Escherichia coli (EAEC) are provided. In particular, Aap and the five gene cluster (aat) of the AA probe region of the pAA plasmid of EAEC 042 have been identified, sequenced, and further characterized. The use of these novel proteins and their corresponding nucleotide sequences for diagnosis, therapy, and prevention of EAEC infections is also provided.",True
626,Polynucleotides encoding novel proteins in enteroaggregative Escherichia coli (EAEC) useful for diagnosis and therapy of EAEC infections,2009,"Novel proteins and their corresponding nucleotide sequences in enteroaggregative Escherichia coli (EAEC) are provided. In particular, Aap and the five gene cluster (aat) of the AA probe region of the pAA plasmid of EAEC 042 have been identified, sequenced, and further characterized. The use of these novel proteins and their corresponding nucleotide sequences for diagnosis, therapy, and prevention of EAEC infections is also provided.",True
627,Proteins in enteroaggregative Escherichia coli (EAEC) useful for diagnosis and therapy of EAEC infections,2009,"Novel proteins and their corresponding nucleotide sequences in enteroaggregative Escherichia coli (EAEC) are provided. In particular, Aap and the five gene cluster (aat) of the AA probe region of the pAA plasmid of EAEC 042 have been identified, sequenced, and further characterized. The use of these novel proteins and their corresponding nucleotide sequences for diagnosis, therapy, and prevention of EAEC infections is also provided.",True
628,Optical interconnect structure in a computer system and method of transporting data between processing elements and memory through the optical interconnect structure,2009,"A multi-chip processor/memory arrangement replacing a large computer chip, includes a number of modules each including processing elements, registers, and/or memories interconnected by an optical interconnection fabric providing an all-to-all interconnection between the chips, so that the memory cells on each chip represent a portion of shared memory. The optical interconnect fabric is responsible for transporting data between the chips while processing elements on each chip dominate processing. Each chip is manufactured in mass production so that the entire processor/memory arrangement is fabricated in an inexpensive and simplified technology process. The optical communication fabric is based on waveguide technology and includes a number of waveguides, the layout of which follows certain constraints. The waveguides can intersect each other in the single plane, or alternatively, a double layer of waveguide structures and bent over approach may be used. Specific layout patterns of the optical waveguides are presented. The communication of data along the optical communication channels is performed in highly pipelined decentralized routing manner and is envisioned for XMT architecture application.",False
629,Discrimination of components of audio signals based on multiscale spectro-temporal modulations,2009,"An audio signal (172) representative of an acoustic signal is provided to an auditory model (105). The auditory model (105) produces a high-dimensional feature set based on physiological responses, as simulated by the auditory model (105), to the acoustic signal. A multidimensional analyzer (106) orthogonalizes and truncates the feature set based on contributions by components of the orthogonal set to a cortical representation of the acoustic signal. The truncated feature set is then provided to classifier (108), where a predetermined sound is discriminated from the acoustic signal.",False
630,"Avian pneumovirus genes, recombinant avian pneumoviruses and methods of making",2009,The present invention is directed to novel avian pneumovirus strain Colorado (APV/CO) genes and intergenic sequences. Also disclosed are methods of making recombinant avian pneumovirus and live-attenuated APV/CO. Further disclosed are methods of diagnosing avian pneumovirus.,True
631,Immunomodulatory compounds,2009,"Compounds are described which modulate the tzrosine kinase activity of p56lck and signal transduction pathways in which this enzyme is involved. The invention also relates to compounds which have immunomodulatory activity, e.g., which have immunosuppressant or immunostimulatory activity, and/or which have an antineoplastic effect. The invention further relates to compositions comprising these compounds, and methods of using them. Compounds are described which modulate the tyrosine kinase activity of p56.",True
632,Electrically driven microfluidic pumping for actuation,2009,"An actuator cell includes a supply chamber containing fluid, and an expansion chamber for receiving fluid from the supply chamber, and being expandable to deform a predetermined area of the actuator cell. The actuator cell further includes a channel providing a fluid flow passage between the supply and expansion chambers, and a compliant material substantially surrounding the supply chamber, the expansion chamber and/or the channel. An electric circuit applies an electric field adjacent the supply and expansion chambers, and thereby causes fluid flow from the supply to the expansion chamber.",False
633,Compositions and methods for modulating interleukin-10,2009,"The present invention provides compositions and methods for upregulating IL-10 production in a stimulated cell. In one aspect, the invention provides methods of identifying ERK activating agents capable of activating and amplifying the ERK MAPK pathway in a cell. Such ERK activating agents are capable of upregulating the production of IL-10 in stimulated cells. In another aspect, the invention provides ERK activating agents identified by the screening methods of the invention. Methods are also provided for preventing and treating inflammation in a susceptible patient by administering to the patient, a therapeutically effective amount of an ERK activating agent identified in accordance with the invention.",True
634,Pharmaceutical composition and method for inhibiting gastrointestinal inflammation,2009,"Peptide antagonists of zonulin are disclosed, as well as methods for the use of the same. The peptide antagonists bind to the zonula occludens receptor, yet do not physiologically modulate the opening of mammalian tight junctions.",True
635,Method of use of peptide antagonists of zonulin to prevent or delay the onset of diabetes,2009,A method for preventing or delaying the onset of autoimmune diseases is disclosed.,True
636,Process for preparation of polyolefins via degenerative transfer polymerization,2009,"Disclosed is a method of producing a polyolefin composition comprising contacting a metallocene pre-catalyst with a substoichiometric amount of a co-catalyst; adding a first olefin monomer; and polymerizing the first monomer for a time sufficient to form the polyolefin. The method allows for the use of a minimum amount of activating co-catalyst, and allows for the production of stereoregular and non-stereoregular polyolefins. The use of configurationally stable metallocene pre-catalysts allows for the production of monomodal isotactic polyolefins having narrow polydispersity. The use of configurationally unstable metallocene pre-catalysts allows for the production of monomodal atactic polyolefins having narrow polydispersity. The method of the present invention optionally further comprises contacting the polyolefin with a second amount of said co-catalyst; adding a second olefin monomer; polymerizing said second olefin monomer to form a block-polyolefin composition. Also disclosed are monomodal diblock copolymer compositions made according to the present invention.",True
637,Breast cancer resistance protein (BCRP) and the DNA which encode it,2009,"The Breast Cancer Resistance Protein is described, as well as the cDNA encoding said protein. This protein has been found to confer resistance to cancer chemotherapeutic drugs.",True
638,Device using a camera and light polarization for the remote displacement of a cursor on a display,2009,"A system and method is provided for imaging a screen of a display device, including filtering light emitted or reflected from the screen and a background region in proximity to the screen using first and second polarizing angles; sensing the filtered light; and generating at least one image set corresponding to the sensed filtered light. Each image set includes at least one image having a first plurality of pixels corresponding to the sensed filtered light using the first polarizing angle and a second plurality of pixels corresponding to the sensed filtered light using the second polarizing angle.",False
639,System and method for performing multi-rank command scheduling in DDR SDRAM memory systems,2009,"A DRAM command scheduling algorithm is presented that is designed to alleviate various constraints imposed upon high performance, high datarate, short channel DDRx SDRAM memory systems. The algorithm amortizes the overhead costs of rank-switching time and schedules around the tFAW bank activation constraint. A multi-rank DDRx memory system is also presented having at least two ranks of memory each having a number of banks and at least one memory controller configured for performing the hardware-implemented step of DRAM command scheduling for row access commands and column access commands. The step of command scheduling includes decoupling the row access commands from the column access commands; alternatively scheduling the decoupled row access commands to different ranks of memory; and group scheduling the decoupled column access commands to each bank of the number of banks of a given rank of the different ranks of memory.",False
640,Synthetic iron oxides and their use as an indicator of reduction in soils (IRIS),2009,"The present invention present invention relates to improved IRIS Fe oxide paint compositions, to the dried (or cured) residue of such paints, and to devices upon which such paint compositions have been applied (IRIS devices) used to assess reducing conditions in soils, especially wetland soils. The improved IRIS Fe oxide paints contain from about 30 to about 70 mole percent goethite, more preferably, from about 40 to about 60 mole percent goethite, and still more preferably, about 50 mole percent goethite.",True
641,Method of modifying glucose activity using polypeptides selectively expressed in fat tissue,2009,"Isolated omentin polypeptides that selectively express in omental fat tissue and methods for the use of the polypeptides. The polypeptides can be used in a method for modifying insulin action and/or glucose metabolism in an animal. The polypeptides can be used to promote glucose uptake by animal adipocytes and other cells, tissues, and/or organs. The polypeptides can also used to provide a therapeutic treatment for diseases of or related to glucose metabolism and adipose tissues. The polypeptides are also incorporated into diagnostic tests and testing kits for diagnosing or detecting a disease or condition involving animal tissue that contains, uses, or expresses the polypeptide in an animal suspected of having the disease or condition.",True
642,SEAMA:a source encoding assisted multiple access protocol for wireless communication,2009,"The invention concerns SEAMA, a source encoding assisted multiple access (MAC) protocol, for integrating voice and data traffic in a wireless network. SEAMA exploits the time variations of the speech coding rate, through statistical multiplexing, to efficiently use the available bandwidth and to increase the link utilization.",False
643,Orientation-independent thermosyphon heat spreader,2009,"Device for enhancing cooling of electronic circuit components that is substantially or fully independent of orientation. A thin profile thermosyphon heat spreader mounted to an electronics package comprises a central evaporator in hydraulic communication with a peripheral condenser, both at least partially filled with liquid coolant. A very high effective thermal conductivity results. Performance is optimized by keeping the evaporator substantially full at all orientations while leaving a void for accumulation of vapor in the condenser. A cover plate and a parallel base plate of generally similar dimension form the evaporator and condenser. Optionally, an opening in the base plate is sealed against the electronics package and places the heat-dissipating component in direct contact with the liquid coolant. Alternatively, the base plate may be formed with the electronics package from a single piece of material. A boiling enhancement structure is provided in the evaporator to encourage vapor bubble nucleation.",False
644,Compact heat exchanging device based on microfabricated heat transfer surfaces,2009,"A lightweight compact self-contained microchannel heat exchanger includes a multi-sided heat transfer member having an array of parallel microgrooves (or rows of micropins) on each of the side, and positioned in thermal contact with the heat generating object to be cooled. A fluid distribution unit having a developed system of feed channels and exhaust channels is mounted to the micropatterned surface for guiding an incoming cold working fluid to remove heat from the microgrooves (or micropins). The heat exchanging device includes in one embodiment a pair of double-sided heat transfer plates having an array of microgrooves extending on each of its opposed surfaces, the fluid distribution unit being sandwiched between the double-sided heat transfer plates. The heat transfer plates and distribution units may be stacked to form a multi-layered cooling system with improved pressure drop and increased heat transfer efficiency. The device may be used in several modes of operation such as single phase convection, thin film evaporation, and forced-feed boiling, and may operate with or without a pump depending on heat transfer requirements.",False
645,Crutch-like mobility assist device with rotatable footer assembly,2009,"A crutch-like mobility assist device includes a vertical support assembly, an underarm support mechanism, and a rotatable footer assembly, the rotatable footer assembly including an elongated ground-engaging foot pad, attachment members connected to the foot pad and having vertical posts, and an elongated connection member with openings through which the vertical posts extend. The connection member includes respective pairs of support blocks on opposite sides of the vertical posts with bores therethrough for shafts that also extend through the posts to enable the posts (and thus the foot pad) to laterally rotate around the shafts. The foot pads can come into parallel contact with the ground even when the vertical support to which it is connected is laterally oriented by the user. Torsion springs connected to the posts will return the posts to a central orientation relative to the connection member when the foot pad is lifted off the ground by the user.",False
646,Accessory cholera enterotoxin and analogs thereof as activators of calcium dependent chloride channel,2009,"Vibrio cholerae accessory cholera enterotoxin (ACE) activates a calcium dependent chloride channel. Ace and Ace analogs can be administered to patients to treat diseases involving defects in chloride secretion by the cystitis fibrosis transmembrane receptor (CFTR). Cystic fibrosis, Dent's disease, X-linked nephrolithiasis, X-linked recessive hypophosphatemic rickets, autosomal dominant myotonia congenita and autosomal recessive general myotonia can be treated by the administration of Ace or an Ace analog. For cystic fibrosis, administration of Ace or an Ace analog increases chloride secretion in the lungs which increases the amount of airway surface water in the lumen of the lungs.",True
647,Method for treating or inhibiting intestinal inflammation,2009,"Peptide antagonists of zonulin are disclosed, as well as methods for the use of the same. The peptide antagonists bind to the zonula occludens receptor, yet do not physiologically modulate the opening of mammalian tight junctions.",True
648,Amine detection method and materials,2009,"Compounds linked to a solid support through a divalent linker moiety are disclosed. In particular, compounds such as 1-hydroxybenzotriazole-6-carboxylic acid are directly linked to the support under mild conditions (i.e., in aqueous or organic solvents at neutral pH and at room temperature). The polymer bound 1-hydroxybenzotriazole-6-carboxylic acid can be used for the derivatization of amines as well as for single step amino group modification of proteins, peptides, and amines via acylation or sulfonylation reactions. A flow through device and method for the single step amino group modifications of proteins, peptides, and amines is disclosed. Also disclosed is a flow through device for the detection of amines in a sample. Additionally, a device and method for the detection of amines in a sample using 1-hydroxybenzotriazole-6-carboxylic acid are disclosed. In a preferred embodiment, the device is used to detect the presence of amines in a spoiled meat product. Diagnostic kits for detecting the presence of amines are also disclosed.",True
649,Methods and compositions for reducing heparan sulfate proteoglycan-mediated clearance of factor VIII,2009,"The present invention provides methods of increasing the half-life factor VIII. More specifically, the invention methods of increasing the half-life of factor VIII by substituting amino acids in the A2 domain or in the C2 domain of factor VIII or in both domains. It further provides factor VIII mutants produced by these methods. The invention also provides a method of using receptor-associated protein (RAP) to increase the half-life of factor VIII. The invention also provides polynucleotides encoding the mutant factor VIII, polynucleotides encoding RAP, and methods of treating hemophilia using the polypeptides and polynucleotides of the invention.",True
650,Methods for screening for modulators of CXCR3 signaling,2009,"CXCR3 is identified as a physiological receptor for Gliadin. Assays for determining modulators of CXCR3 signaling are provided. Fragments of gliadin which function as inhibitors of CXCR3 signaling can be determined. Methods for treating diseases relating to gluten and/or autoimmunity by targeting CXCR3 are provided. Such diseases include celiac disease, gluten sensitivity, gluten allergy, rheumatoid arthritis, multiple sclerosis, immune-mediated or type 1 diabetes mellitus, inflammatory bowel diseases, systemic lupus erythematosus, psoriasis, scleroderma, and autoimmune thyroid diseases.",True
651,Method for controlling uniformity of thin films fabricated in processing systems,2009,"A method for spatial uniformity control in thin film processing is devised which is applicable to any film quality (thickness, composition, microstructure, electrical properties, etc.) as well as to all deposition systems (CVD, PVD, etch, ALD, etc.) where the substrate is rotated to improve uniformity of the deposited thin films. The technique is based on identifying the subspace of all deposition profiles on the stationary substrate that produce uniform films under rotation and then projecting a deposition profile to be controlled onto a sequence of uniformity—producing basis functions spanning that subspace to determine the Nearest Uniformity Producing Profile (NUPP). The process parameters as well as reactor design are optimized in order to minimize uniformity optimization criterion defined as a deviation of a produced deposition profile on the stalled substrate from the NUPP.",False
652,Methods and devices for performing cardiac valve repair,2009,"The present invention is directed to methods and devices for repairing a cardiac valve. Generally, the methods involve a minimally invasive procedure that includes creating an access in the apex region of the heart through which one or more instruments may be inserted so as to repair a cardiac valve, for instance, a mitral or tricuspid valve. Accordingly, the methods are useful for performing a variety of procedures to effectuate a repair. For instance, in one embodiment, the methods are useful for repairing a cardiac valve by implanting one or more artificial heart valve chordae tendinae into one or more cardiac valve leaflet tissues so as to restore the proper leaflet function and thereby prevent reperfusion. In another embodiment, the methods are useful for repairing a cardiac valve by resecting a portion of one or more cardiac valve leaflets and implanting one or more sutures into the resected valve tissues, which may also include the implantation of an annuloplasty ring. In an additional embodiment, the methods are useful for performing an edge to edge bow-tie repair (e.g., an Alfieri repair) on cardiac valve tissues. Devices for performing the methods of the invention are also provided.",False
653,All-optical timing jitter measurement system and method,2009,"A timing jitter measurement system and method is provided that acquires the timing jitter in an all-optical fashion, by extracting the timing jitter probability distribution function using auto-correlation and cross-correlation data. This makes the system and method of the present invention particularly useful for ultra-high bit rates, where power spectrum analysis cannot be applied. The resolution of the timing jitter measurement system and method is higher than the actual pulse width, and depends on the time resolution of the correlator. The system and method of the present invention facilitates the identification of deterministic or random timing jitters or combinations thereof, and therefore can be used to identify the origins of timing jitters within the optical network and to provide feedback to the optical network that can be used to actively control the timing jitter.",False
654,Two-dimensional microfluidics for protein separations and gene analysis,2010,"The invention provides a microfluidic apparatus for performing 2-D biomolecular separations. The microfluidic 2-D device may include first and second planar substrates which include at least a first dimension microchannel extending in a first direction and an array of second dimension microchannels extending in a second direction, preferably, orthogonal to the first dimension. The ends of at least some of the microchannels are in fluid communication with a plurality of reservoirs. The substrates may further include a number of microchannels and reservoirs. The reservoirs are in electrical communication with a plurality of electrodes and voltage power sources. The device enables two dimensional separations of proteins, DNA and other biomolecules. According to another aspect of the invention, an array of tertiary microchannels extending in a third direction may be utilized.",False
655,Arbitrary and simultaneous control of multiple objects in microfluidic systems,2010,"In a microfluidic device, respective motion of a plurality of objects along corresponding trajectories is achieved by determining a force field, such as an underlying fluid flow which, when applied to the plurality of object, moves each object along its corresponding trajectory. The force field is a linear superposition of a subset of all force fields supported by the physical characteristics of the microfluidic device. Once the fields have been ascertained, a plurality of actuation signals corresponding to the fields is applied to actuators installed on the microfluidic device to cause the force on each object. By implementing a feedback structure, corrections for positional errors may be made by computing a corrective force for each object and adjusting the actuation signals appropriately thereto.",False
656,Method and system for power controlled effective allocation of sub-bands in ultra-wideband communication,2010,"A power controlled sub-band assignment and power allocation among users in a multiband UWB system aims to reduce power consumption without compromising performance. The overall transmit power is minimized under the practical constraints, including packet error rate, transmission rate, and FCC regulations. To insure the system feasibility in variable channel conditions, an optimization scheme manages the assignment of UWB devices to respective channels subject to their suitability to the requested users' transmission rates. An inexpensive suboptimal approach reduces the complexity of the optimization procedure and achieves a comparable performance to those of the complex full search optimization routine. The suboptimal scheme obtains the feasible solutions adaptively when the channels assignment, initially calculated under the optimization criteria, is not feasible for the user's rate requirement.",False
