ID,patent_title,patent_year,patent_abstract,label
1,Method for binding site identification by molecular dynamics simulation (silcs: site identification by ligand competitive saturation),2018,"The invention describes an explicit solvent all-atom molecular dynamics methodology (SILCS: Site Identification by Ligand Competitive Saturation) that uses small aliphatic and aromatic molecules plus water molecules to map the affinity pattern of a large molecule for hydrophobic groups, aromatic groups, hydrogen bond donors, and hydrogen bond acceptors. By simultaneously incorporating ligands representative of all these functionalities, the method is an in silico free energy-based competition assay that generates three-dimensional probability maps of fragment binding (FragMaps) indicating favorable fragment:large molecule interactions. The FragMaps may be used to qualitatively inform the design of small-molecule ligands or as scoring grids for high-throughput in silico docking that incorporates both an atomic-level description of solvation and the large molecule's flexibility.",False
2,Methods for recovery of leaf proteins,2018,"A novel method for processing soluble plant leaf proteins is described. While leaf proteins are considered potentially the most abundant source of protein in nature, the lack of efficient processing techniques for leaf proteins has limited their commercial use. The method described in this patent provides a means of extracting and purifying leaf proteins from plants which is suitable for leaf protein production on an industrial scale.",True
3,Bacterial live vector vaccines expressing chromosomally-integrated foreign antigens,2018,"Bacterial live vector vaccines represent a vaccine development strategy that offers exceptional flexibility. In the present invention, genes encoding protective antigens of unrelated bacterial, viral, parasitic, or fungal pathogens are expressed in an attenuated bacterial vaccine strain that delivers these foreign antigens to the immune system, thereby eliciting relevant immune responses. Rather than expressing these antigens using only low copy expression plasmids, expression of foreign proteins is accomplished using both low copy expression plasmids in conjunction with chromosomal integrations within the same live vector. This strategy compensates for the inherent disadvantage of loss of gene dosage (versus exclusive plasmid-based expression) by integrating antigen expression cassettes into multiple chromosomal sites already inactivated in an attenuated vector.",True
4,"Systems, methods, and devices for health monitoring of an energy storage device",2018,A health monitoring device includes an ultrasound source and an ultrasound sensor. The ultrasound source can be configured to generate and direct ultrasound at an energy storage device. The ultrasound sensor can be configured to detect ultrasound reflected from or transmitted through the energy storage device and to generate a signal responsive to the detected ultrasound from the energy storage device. A control unit can be configured to determine a state of health of the energy storage device based on the signal from the ultrasound sensor.,False
5,Sparse decomposition of head related impulse responses with applications to spatial audio rendering,2018,"This application describes methods of signal processing and spatial audio synthesis. One such method includes accepting an auditory signal and generating an impression of auditory virtual reality by processing the auditory signal to impute a spatial characteristic on it via convolution with a plurality of head-related impulse responses. The processing is performed in a series of steps, the steps including: performing a first convolution of an auditory signal with a characteristic-independent, mixed-sign filter and performing a second convolution of the result of first convolution with a characteristic-dependent, sparse, non-negative filter. In some described methods, the first convolution can be pre-computed and the second convolution can be performed in real-time, thereby resulting in a reduction of computational complexity in said methods of signal processing and spatial audio synthesis.",False
6,Combination dopamine antagonist and opiate receptor antagonist treatment of addictive behavior,2018,"The present invention is directed to a method of treating or preventing an addictive behavior in a subject, said method comprising administering to said subject an effective amount of a dopamine antagonist and a opiate receptor antagonist or a composition comprising same. Further provided are pharmaceutical compositions comprising, as active substances, at least one dopamine antagonist and at least one opiate receptor antagonist.",True
7,Flapping wing aerial vehicles,2018,"An autonomous flapping wing aerial vehicle can have a vehicle body, a pair of flapping wings, tunable wing hinges, and elastic drive mechanisms. The tunable wing hinges can be coupled to the flapping wings. Each wing hinge can be constructed to deliver a force to a respective one of the flapping wings to alter end points of a stroke thereof. The elastic drive mechanisms can rotate the flapping wings about pivot points to produce the strokes of the flapping wings. The elastic drive mechanism can be driven at or near a resonance thereof. Alterations to the strokes of the flapping wings produced by the combined effect of the tunable wing hinges and the elastic drive mechanisms, operating in parallel, can provide steering control of the aerial vehicle.",False
8,Compositions and vaccines comprising vesicles and methods of using the same,2018,"The disclosure relates to compositions, pharmaceutical compositions, vaccines, and methods of making and using the same. The compositions of the disclosure are useful to stimulate an antigen-specific immune response and, in some embodiments, a protective immune response in an animal after challenge to pathogens. The compositions of the disclosure are also useful for treatment and prevention of disease in a subject such as cancer.",True
9,"Solid-state heating or cooling systems, devices, and methods",2018,"A system for heating/cooling includes a plurality of thermoelastic modules. Each of the modules includes one or more structures formed of shape memory alloy, which converts from austenite to martensite upon application of a first stress and release latent heat from the conversion. During a first part of a heating/cooling cycle, a first module is stressed to cause conversion. The latent heat released from the first module is rejected to a heat sink while a second unstressed module absorbs heat from a heat source. During a second part of the heating/cooling cycle, the first and second modules are connected together to transfer heat therebetween for heat recovery. The cycle can be repeated indefinitely with the first and second modules alternating roles. Structures of the thermoelastic cooling material and specific applications thereof are also disclosed.",False
10,"Surface vehicle trajectory planning systems, devices, and methods",2018,"A planning module for a water surface vehicle can determine a vehicle trajectory that avoids one or more moving obstacles, such as civilian marine vessels, by performing a lattice-based heuristic search of a state space for the surface vehicle and selecting control action primitives from a predetermined set of control action primitives based on the search. The planning module can separate a travel space into a plurality of regions and can independently scale the control action primitives in each region based on the moving obstacles therein. The heuristic search includes evaluating a cost function at each state of the state space. The cost function can be based on at least predicted movement of the obstacles responsive to respective maneuvers performed by the surface vehicle at each node of the search.",False
11,Extending and maintaining micropore viability of microneedle treated skin with lipid biosynthesis inhibitors for sustained drug delivery,2018,"Microneedles and their use as a physical skin permeation enhancement technique facilitate drug delivery across the skin in therapeutically relevant concentrations. Micropores created in the skin by MNs reseal because of normal healing processes of the skin, thus limiting the duration of the drug delivery window. Pore lifetime enhancement strategies can increase effectiveness of MNs as a drug delivery mechanism by prolonging the delivery window. Fluvastatin (FLU) was used to enhance pore lifetime by inhibiting the synthesis of cholesterol, a major component of the stratum corneum lipids. The skin recovered within a 30-45-min time period following the removal of occlusion, and there was no significant irritation observed due to the treatment compared to the control sites. Thus, it can be concluded that localized skin treatment with FLU can be used to extend micropore lifetime and deliver drugs for up to 7 days across MN-treated skin.",True
12,Solid hemoglobin-polymer biophotonic phantoms and their use,2018,"Novel biophotonic phantoms are provided herein that can accurately mimic the optical properties of living tissue. The disclosed biophotonic phantoms comprise hemoglobin (Hb) in a native conformation that is distributed in a solid polymer matrix. Methods of producing the disclosed biophotonic phantoms are also provided. The biophotonic phantoms can be used, for example, to calibrate or test an optical imaging system, such as a near infrared spectroscopy imaging system.",False
13,"Directional surface plasmon coupled fluorescence and chemiluminescence from thin films of nickel, iron or palladium and uses thereof",2018,"Nickel, iron and palladium thin films thermally evaporated onto glass supports are used to demonstrate surface plasmon coupled fluorescence (SPCF) and surface plasmon couple chemiluminescence (SPCC) over a broad wavelength range (400-800 nm) for potential assays or other detection systems. Nickel, iron and palladium thin films used in SPCF and SPCC convert otherwise isotropic emission into highly directional and polarized emission, an attractive concept for surface assays. The emission angles of detected emissions occur over a 10 degree range for tested emitted wavelengths.",False
14,Metal-enhanced bioluminescence: an approach for monitoring biological bioluminescent processes,2018,"The present invention relates to surface plasmon-coupled bioluminescence, wherein bioluminescent emission from a bioluminescent chemical reaction couples to surface plasmons in metallized particles thereby enhancing the signal. Importantly, these plasmonic emissions emitted from metallic particles generated without an external excitation source but instead from induced electronically excited states caused by the bioluminescent chemical reaction.",False
15,"Nanodevice arrays for electrical energy storage, capture and management and method for their formation",2018,"An apparatus, system, and method are provided for a vertical two-terminal nanotube or microtube device configured to capture and generate energy, to store electrical energy, and to integrate these functions with power management circuitry. The vertical device can include a column disposed in a template material extending from one side of the template material to the other side of the template material. Further, the device can include a first material disposed within the column, a second material disposed within the column, and a third material disposed in the column. A variety of configurations, variations, and modifications are provided.",False
16,Neuroparticle with a spin-torque device,2018,"Disclosed embodiments enable determining and monitoring the location of at least one particle in a subject's body, as well as the status of a local environment within the body where the at least one particle is located.",False
17,Compositions and methods for making biodegradable structures,2018,"A composition including PPF or a PPF copolymer that can be used to fabricate biodegradable structures. The composition can be used in 3-D patterning (e.g., 3-D printing and sterolighography) methods. For example, 3-D patternable compositions include PPF or a PPF copolymer, a photoinitiator or photoinitiators, and a resolution control inhibitor or inhibitors. The compositions can be used to make biodegradable structures (such as cardivascular scaffolds). The biodegradable structures can be surface functionalized. The biodegradable structures can be used in methods of blood delivery in an individual.",False
18,Lambodies with high affinity and selectivity for glycans and uses therefor,2018,"The invention relates to dimeric proteins comprised of subunits having (i) recombinant lamprey variable lymphocyte receptor (VLR) diversity regions linked to (ii) multimerization domains. The dimeric proteins exhibit binding specificity for glycosylated antigens, and they may be used in methods of detecting or isolating glycans from a sample, and in methods of disease diagnosis, prognosis, progression monitoring, treatment, and imaging.",True
19,High efficiency solid fuel burning stove with optimized burning conditions and low level of emission,2018,A solid fuel stove uses a dynamically controlled Combustion Fan and a Smart Controller system for automatic regulation of combustion conditions through the controlled forced air circulation based on sensors readings. The stove also uses emission reducing and efficiency boosting equipment such as a co-axial stack heat recovery sub-system and a self-cleaning particulate collector with enhanced particulates trapping capabilities.,False
20,Multivalent live vector vaccine against Clostridium difficile-associated disease,2018,The invention relates to a multivalent Clostridium difficile vaccine comprising a Salmonella Typhi live vector comprising the cell binding domain of TcdA toxin (CBD/A) of Clostridium difficile or an antigenic fragment thereof and the cell binding domain of TcdB toxin (CBD/B) of Clostridium difficile or an antigenic fragment thereof and optionally the cell-binding subunit component (CdtB) of binary toxin of Clostridium difficile or an antigenic fragment thereof. The invention further provides methods of inducing an immune response and methods of preventing recurrence of C. difficile infections in subjects.,True
21,"Design, synthesis and methods of use of acyclic fleximer nucleoside analogues having anti-coronavirus activity",2018,"The present invention is directed to compounds, methods and compositions for treating or preventing viral infections using nucleosides analogs. Specifically, the present invention provides for the design and synthesis of acyclic fleximer nucleoside analogues having increased flexibility and ability to alter their conformation structures to provide increased antiviral activity potential with the result of inhibiting several coronaviruses.",True
22,Ultra-fast pathogen toxin detection assay based on microwave-accelerated metal-enhanced fluorescence,2018,"The present invention provides for a system and method to detect low levels of the anthrax protective antigen (PA) exotoxin in biological fluids, wherein the system uses a metal-enhanced fluorescence (MEF)-PA assay in combination with microwave-accelerated PA protein surface absorption. Microwave irradiation rapidly accelerates PA deposition onto the surface adjacent to deposited metallic particles and significantly speeding up the MEF-PA assay and resulting in a total assay run time of less than 40 min with an analytical sensitivity of less than 1 pg/ml PA.",False
23,Local engineering of the lymph node environment to promote immune tolerance,2018,"A method of inducing specific immune tolerance to myelin in an individual is provided. The method includes introducing directly into a lymph node of the individual an effective amount of a composition that contains a myelin antigen, a biodegradable material and at least one tolerogenic agent. The method is suitable for reducing the severity of symptoms of multiple sclerosis in individuals who suffer from primary-progressive multiple sclerosis (PPMS), and can halt or even reverse PPMS progression.",True
24,Method of coating of object,2018,"A method of coating a metallic object with a substantially invisible protective coating, wherein the coating comprises a first layer, a second layer, and a third layer, each layer comprising a metal oxide or a nitride. The method comprises placing the object in an atomic layer deposition (ALD) reactor; depositing a first layer comprising a metal oxide or a nitride on a surface of the object by ALD; depositing a second layer comprising a metal oxide or a nitride on the first layer by ALD; and depositing a third layer comprising a metal oxide or a nitride on the second layer by ALD, thereby forming the protective coating on the object.",False
25,Systems and methods using multi-wavelength single-pulse Raman spectroscopy,2018,"The invention provides methods and apparatus comprising a multi-wavelength laser source that uses a single unfocused pulse of a low intensity but high power laser over a large sample area to collect Raman scattered collimated light, which is then Rayleigh filtered and focused using a singlet lens into a stacked fiber bundle connected to a customized spectrograph, which separates the individual spectra from the scattered wavelengths using a hybrid diffraction grating for collection onto spectra-specific sections of an array photodetector to measure spectral intensity and thereby identify one or more compounds in the sample.",False
26,Optomechanical laser for dynamic measurement,2018,"An optomechanical laser includes: a basal member; a mechanical transducer; a laser disposed on the mechanical transducer, the laser being displaced along the displacement axis in response to a displacement of the mechanical transducer relative to the basal member; a mirror disposed on the armature in optical communication with the laser and opposing the laser; the armature disposed on the basal member and rigidly connecting the mirror to the basal member such that the mirror and the armature move in synchrony with the basal member, and the armature provides a substantially constant distance between the basal member and the mirror; and a cavity comprising: the laser; the mirror; and a cavity length between the laser and the mirror that changes in response to displacement of the laser according to the displacement of the mechanical transducer relative to the basal member, the optomechanical laser providing laser light.",False
27,Swine influenza viruses and constructs and uses thereof,2018,"Disclosed are compositions and methods comprising vectors and a reverse genetics competent unit comprising one or more recombinant influenza viruses. Recombinant influenza viruses comprising swine RNA polymerase I promoter are disclosed. Constructs comprising swine RNA polymerase I promoter nucleic acid sequences are also provided. Methods of inducing protecting immunity with the recombinant influenza viruses are disclosed. In certain embodiments, the reverse genetics competent unit comprises pathogenic units necessary for producing pathogens de novo from a nucleotide-based vector for influenza virus in swine.",True
28,Plasmon-enhanced terahertz graphene-based photodetector and method of fabrication,2018,"A plasmon-enhanced terahertz graphene-based photodetector exhibits an increased absorption efficiency attained by utilizing a tunable plasmonic resonance in sub-wavelengths graphene micro-ribbons formed on SiC substrate in contact with an array of bi-metallic electrode lines. The orientation of the graphene micro-ribbons is tailored with respect to the array of sub-wavelengths bi-metallic electrode lines. The graphene micro-ribbons extend at the angle of approximately 45 degrees with respect to the electrode lines in the bi-metal electrodes array. The plasmonic mode is efficiently excited by an incident wave polarized perpendicular to the electrode lines, and/or to the graphene micro-ribbons. The absorption of radiation by graphene is enhanced through tunable geometric parameters (such as, for example, the width of the graphene micro-ribbons) and control of a carrier density in graphene achieved through tuning the gate voltage applied to the photodetector.",False
29,Apparatus and method for use in analyzing a patient'S bowel,2018,"An apparatus and method are provided for use in studying a patient's bowel which combines recording and analysis of physiologic parameters and patient sensory perception. A pain input detector, a pain transducer, and a processor are provided. A gas pressure transducer and flow meter may also be provided. Output data may be generated to reflect perceived patient pain, volume of gas delivered to the patient's bowel, and bowel pressure. An indication of perceived patient pain is processed by the processor to generate data that may used to validate a scan of a patient or may be used as a diagnostic tool.",False
30,"C-17-heteroaryl steroidal CYP17 inhibitors/antiandrogens, in vitro biological activities, pharmacokinetics and antitumor activity",2018,"Described are steroidal C-17 benzoazoles, pyrimidinoazoles (azabenzoazoles) and diazines. Methods for their synthesis are also described, which include methods having a step of nucleophilic vinylic “addition-elimination” substitution reaction of 3β-acetoxy-17-chloro-16-formylandrosta-5,16-diene or analogs thereof and benzoazole or pyrimidinoazole nucleophiles and methods having a palladium catalyzed cross-coupling reaction of 17-iodoandrosta-5,16-dien-3β-ol or analogs thereof with tributylstannyl diazines. The compounds are potent inhibitors of human CYP17 enzyme as well as potent antagonists of both wild type and mutant androgen receptors (AR). The compounds are useful for the treatment of human prostate cancer.",True
31,Bridgeless resonant AC-DC converters and systems and control systems therefor,2018,An AC-to-DC converter includes a multi-resonant switching circuit including an AC-AC stage soft-switched LC network that converts a low-frequency low-amplitude alternating input voltage into a higher-frequency higher-amplitude alternating voltage and an AC-DC stage rectifying the higher-frequency higher-amplitude alternating voltage into a DC output voltage via a soft-switched diode. An AC-to-DC converter system includes at least two multi-resonant switching circuits that include at least two AC-AC stages and an AC-DC stage. A control system for the AC-to-DC converter includes at least two resonant gate drivers that each includes: one MOSFET gate configured to transmit a gate voltage signal to an AC-to-DC converter; an on/off logic module electrically coupled to the MOSFET gate; a resonant tank LC circuit electrically coupled to the on/off logic module; and a voltage bias module electrically coupled to the resonant tank LC circuit.,False
32,Therapy regimen and methods to sensitize cancer cells treated with epigenetic therapy to PARP inhibitors in ovarian cancer,2018,The presently disclosed subject matter provides methods to treat cancer cells using low doses of DNA demethylating agents and poly ADP ribose polymerase (PARP) inhibitors. Methods also are provided for sensitizing a cell to a PARP inhibitor.,True
33,Therapy regimen and methods to sensitize cancer cells treated with epigenetic therapy to PARP inhibitors in lung cancer,2018,The presently disclosed subject matter provides methods to treat cancer cells using low doses of DNA demethylating agents and poly ADP ribose polymerase (PARP) inhibitors. Methods also are provided for sensitizing a cell to a PARP inhibitor.,True
34,Microfluidic chip for analysis of cell motility and methods for using same,2018,The present invention describes an integrated apparatus that enables identification of migratory cells directly from a specimen. The apparatus only requires a small number of cells to perform an assay and includes novel topographic features which can reliably differentiate between migratory and non-migratory cell populations in a sample. Both the spontaneous and chemotactic migration of cancer cells may be measured to distinguish between subpopulations within a tumor sample. The migratory cells identified using the apparatus and methods of the present invention may be separated and further analyzed to distinguish factors promoting metastasis within the population. Cells in the apparatus can be treated with chemotherapeutic or other agents to determine drug strategies to most strongly inhibit migration. The use of optically transparent materials in some embodiments allows a wide range of imaging techniques to be used for in situ imaging of migratory and non-migratory cells in the apparatus. The apparatus and methods of the present invention are useful for predicting the metastatic propensity of tumor cells and selecting optimal drugs for personalized therapies.,False
35,"One dimensional photonic crystals for enhanced fluorescence based sensing, imaging and assays",2018,"Techniques for enhanced fluorescence include a functionalized substrate for a target optical frequency comprising a one dimensional photonic crystal that is functionalized with a bioactive target molecule that has an affinity for a particular analytic. The one dimensional photonic crystal includes a plurality of dielectric layers including a plurality of high index of refraction layers alternating with a plurality of low index of refraction layers. The thickness of each layer is within a factor of four of a wavelength of the optical frequency in the layer. For emissions from a fluorophore bound to the target molecule and excited by incident light, there is an emission intensity maximum centered at an angle independent of the direction of the incident light.",False
